{
  "ContractId": "eMAS.MS04.PreSales.Identification/1.0",
  "Execution": {
    "Capability": "IdentificationInterpretation",
    "ExecutionId": "EXE-ORACLE-IDO-18",
    "EngineVersion": null,
    "StartedAtUtc": null,
    "CompletedAtUtc": null,
    "CompletionStatus": "Completed"
  },
  "EvidenceSource": {
    "ContractId": "eMAS.MS04.PreSales.ScannerObservations/1.0",
    "ExecutionId": "EXE-ORACLE-IDO-18",
    "DocumentSha256": "afaa51417a01500051b1be8cb415ab36cff37865c5c512c258f745a0abf4832c"
  },
  "RuntimeConfig": {
    "ConfigurationId": "ORACLE_IDO_18",
    "SchemaVersion": "1.1.0",
    "MappingVersion": "1.0.0",
    "ExportType": "DEV",
    "Sha256": "691b42acb10f9005b25158212ff690c2e0e34bbcfdff4dbe661954075049ff80"
  },
  "Normalization": {
    "PolicyId": "EVIDENCE-STRENGTH-NORMALIZATION",
    "Version": "1",
    "Mapping": {
      "Strong": "STRONG",
      "Supporting": "MEDIUM",
      "Weak": "WEAK"
    }
  },
  "FieldProjection": {
    "PolicyId": "CEC-FIELD-PROJECTION",
    "Version": "1"
  },
  "Results": [
    {
      "IdentificationId": "IDR-0001",
      "SubjectType": "Sequence",
      "SubjectId": "SEQ-0001",
      "DossierId": "DOS-0001",
      "Dimension": "TECHNICAL_STANDARD",
      "EvaluationStatus": "Evaluated",
      "Value": "ICH_ECTD_3_2_2",
      "ValueSet": null,
      "Confidence": "MEDIUM",
      "ReviewRequired": false,
      "ValueSource": "Derived",
      "Candidates": [
        {
          "Value": "ICH_ECTD_3_2_2",
          "BestSupportStrength": "STRONG",
          "BestContradictionStrength": null,
          "SupportingRuleIds": [
            "ID-TS-ROOT"
          ],
          "ContradictingRuleIds": [],
          "SupportingEvidence": [
            {
              "EvidenceId": "EVD-0003",
              "RawStrength": "Strong",
              "NormalizedStrength": "STRONG",
              "SourceTier": "StructuredXml"
            },
            {
              "EvidenceId": "EVD-0004",
              "RawStrength": "Strong",
              "NormalizedStrength": "STRONG",
              "SourceTier": "StructuredXml"
            }
          ],
          "ContradictingEvidence": []
        }
      ],
      "SupportingEvidenceIds": [
        "EVD-0003",
        "EVD-0004"
      ],
      "ContradictingEvidenceIds": [],
      "UnavailableEvidence": [],
      "FiredRuleIds": [
        "ID-TS-ROOT"
      ],
      "ScoreSummary": {
        "ScoreModel": "ORDINAL_TIER/1",
        "BestStrength": "STRONG",
        "TierRank": 1,
        "CountByStrength": {
          "STRONG": 1,
          "MEDIUM": 0,
          "WEAK": 0
        },
        "IndependentSourceClassCount": 1
      },
      "LimitingFactors": []
    },
    {
      "IdentificationId": "IDR-0002",
      "SubjectType": "Sequence",
      "SubjectId": "SEQ-0001",
      "DossierId": "DOS-0001",
      "Dimension": "REGIONAL_IMPLEMENTATION",
      "EvaluationStatus": "NotAssessed",
      "Value": null,
      "ValueSet": null,
      "Confidence": "UNKNOWN",
      "ReviewRequired": true,
      "ValueSource": null,
      "Candidates": [],
      "SupportingEvidenceIds": [],
      "ContradictingEvidenceIds": [],
      "UnavailableEvidence": [],
      "FiredRuleIds": [],
      "ScoreSummary": {
        "ScoreModel": "ORDINAL_TIER/1",
        "BestStrength": null,
        "TierRank": null,
        "CountByStrength": {
          "STRONG": 0,
          "MEDIUM": 0,
          "WEAK": 0
        },
        "IndependentSourceClassCount": null
      },
      "LimitingFactors": [
        "NoIdentificationRuleConfigured"
      ]
    }
  ]
}
