{
  "ContractId": "eMAS.MS04.PreSales.Identification/1.0",
  "Execution": {
    "Capability": "IdentificationInterpretation",
    "ExecutionId": "EXE-ORACLE-IDO-22",
    "EngineVersion": null,
    "StartedAtUtc": null,
    "CompletedAtUtc": null,
    "CompletionStatus": "Completed"
  },
  "EvidenceSource": {
    "ContractId": "eMAS.MS04.PreSales.ScannerObservations/1.0",
    "ExecutionId": "EXE-ORACLE-IDO-22",
    "DocumentSha256": "1a5e6bd2be607cc68427f07afde5592d8633dafd332a93aba6f293a3f964f997"
  },
  "RuntimeConfig": {
    "ConfigurationId": "ORACLE_IDO_22",
    "SchemaVersion": "1.1.0",
    "MappingVersion": "1.0.0",
    "ExportType": "DEV",
    "Sha256": "b2ced565e12d56d12ff16ab74224a74635de46150da0ab6cbdadb5f1f938ba83"
  },
  "Normalization": {
    "PolicyId": "EVIDENCE-STRENGTH-NORMALIZATION",
    "Version": "1",
    "Mapping": {
      "Strong": "STRONG",
      "Supporting": "MEDIUM",
      "Weak": "WEAK"
    }
  },
  "FieldProjection": {
    "PolicyId": "CEC-FIELD-PROJECTION",
    "Version": "1"
  },
  "Results": [
    {
      "IdentificationId": "IDR-0001",
      "SubjectType": "Sequence",
      "SubjectId": "SEQ-0001",
      "DossierId": "DOS-0001",
      "Dimension": "TECHNICAL_STANDARD",
      "EvaluationStatus": "Evaluated",
      "Value": "ICH_ECTD_3_2_2",
      "ValueSet": null,
      "Confidence": "MEDIUM",
      "ReviewRequired": false,
      "ValueSource": "Derived",
      "Candidates": [
        {
          "Value": "ICH_ECTD_3_2_2",
          "BestSupportStrength": "STRONG",
          "BestContradictionStrength": null,
          "SupportingRuleIds": [
            "ID-TS-NS-PATTERN-CI"
          ],
          "ContradictingRuleIds": [],
          "SupportingEvidence": [
            {
              "EvidenceId": "EVD-0004",
              "RawStrength": "Strong",
              "NormalizedStrength": "STRONG",
              "SourceTier": "StructuredXml"
            }
          ],
          "ContradictingEvidence": []
        }
      ],
      "SupportingEvidenceIds": [
        "EVD-0004"
      ],
      "ContradictingEvidenceIds": [],
      "UnavailableEvidence": [],
      "FiredRuleIds": [
        "ID-TS-NS-PATTERN-CI"
      ],
      "ScoreSummary": {
        "ScoreModel": "ORDINAL_TIER/1",
        "BestStrength": "STRONG",
        "TierRank": 1,
        "CountByStrength": {
          "STRONG": 1,
          "MEDIUM": 0,
          "WEAK": 0
        },
        "IndependentSourceClassCount": 1
      },
      "LimitingFactors": []
    }
  ]
}
