{
  "ContractId": "eMAS.MS04.PreSales.Identification/1.0",
  "Execution": {
    "Capability": "IdentificationInterpretation",
    "ExecutionId": "EXE-ORACLE-IDO-09",
    "EngineVersion": null,
    "StartedAtUtc": null,
    "CompletedAtUtc": null,
    "CompletionStatus": "Completed"
  },
  "EvidenceSource": {
    "ContractId": "eMAS.MS04.PreSales.ScannerObservations/1.0",
    "ExecutionId": "EXE-ORACLE-IDO-09",
    "DocumentSha256": "73d407d9b9597e25a633e3791516107f26709cd2bd89aa8df0983b5c382eb64b"
  },
  "RuntimeConfig": {
    "ConfigurationId": "ORACLE_IDO_09",
    "SchemaVersion": "1.1.0",
    "MappingVersion": "1.0.0",
    "ExportType": "DEV",
    "Sha256": "6638678733f83366b198dac9084353633a10cc2afe0969e70b33aa724a4fe95a"
  },
  "Normalization": {
    "PolicyId": "EVIDENCE-STRENGTH-NORMALIZATION",
    "Version": "1",
    "Mapping": {
      "Strong": "STRONG",
      "Supporting": "MEDIUM",
      "Weak": "WEAK"
    }
  },
  "FieldProjection": {
    "PolicyId": "CEC-FIELD-PROJECTION",
    "Version": "1"
  },
  "Results": [
    {
      "IdentificationId": "IDR-0001",
      "SubjectType": "Sequence",
      "SubjectId": "SEQ-0001",
      "DossierId": "DOS-0001",
      "Dimension": "TECHNICAL_STANDARD",
      "EvaluationStatus": "Evaluated",
      "Value": "ICH_ECTD_3_2_2",
      "ValueSet": null,
      "Confidence": "HIGH",
      "ReviewRequired": false,
      "ValueSource": "Derived",
      "Candidates": [
        {
          "Value": "ICH_ECTD_3_2_2",
          "BestSupportStrength": "STRONG",
          "BestContradictionStrength": null,
          "SupportingRuleIds": [
            "ID-TS-PRES",
            "ID-TS-ROOT"
          ],
          "ContradictingRuleIds": [],
          "SupportingEvidence": [
            {
              "EvidenceId": "EVD-0002",
              "RawStrength": "Supporting",
              "NormalizedStrength": "MEDIUM",
              "SourceTier": "OfficialPhysicalPath"
            },
            {
              "EvidenceId": "EVD-0003",
              "RawStrength": "Strong",
              "NormalizedStrength": "STRONG",
              "SourceTier": "StructuredXml"
            },
            {
              "EvidenceId": "EVD-0004",
              "RawStrength": "Strong",
              "NormalizedStrength": "STRONG",
              "SourceTier": "StructuredXml"
            }
          ],
          "ContradictingEvidence": []
        }
      ],
      "SupportingEvidenceIds": [
        "EVD-0002",
        "EVD-0003",
        "EVD-0004"
      ],
      "ContradictingEvidenceIds": [],
      "UnavailableEvidence": [],
      "FiredRuleIds": [
        "ID-TS-PRES",
        "ID-TS-ROOT"
      ],
      "ScoreSummary": {
        "ScoreModel": "ORDINAL_TIER/1",
        "BestStrength": "STRONG",
        "TierRank": 1,
        "CountByStrength": {
          "STRONG": 1,
          "MEDIUM": 1,
          "WEAK": 0
        },
        "IndependentSourceClassCount": 2
      },
      "LimitingFactors": []
    }
  ]
}
