{
  "ContractId": "eMAS.MS04.PreSales.Identification/1.0",
  "Execution": {
    "Capability": "IdentificationInterpretation",
    "ExecutionId": "EXE-ORACLE-IDO-07",
    "EngineVersion": null,
    "StartedAtUtc": null,
    "CompletedAtUtc": null,
    "CompletionStatus": "Completed"
  },
  "EvidenceSource": {
    "ContractId": "eMAS.MS04.PreSales.ScannerObservations/1.0",
    "ExecutionId": "EXE-ORACLE-IDO-07",
    "DocumentSha256": "ef52efd63594e0afa16588bc0f6d9b59b43349036b5a91abec5a8b5d428b5df4"
  },
  "RuntimeConfig": {
    "ConfigurationId": "ORACLE_IDO_07",
    "SchemaVersion": "1.1.0",
    "MappingVersion": "1.0.0",
    "ExportType": "DEV",
    "Sha256": "64b50cc52b6bad08c9d130657dfb828247148fe085a3048de82466e3a0e90d32"
  },
  "Normalization": {
    "PolicyId": "EVIDENCE-STRENGTH-NORMALIZATION",
    "Version": "1",
    "Mapping": {
      "Strong": "STRONG",
      "Supporting": "MEDIUM",
      "Weak": "WEAK"
    }
  },
  "FieldProjection": {
    "PolicyId": "CEC-FIELD-PROJECTION",
    "Version": "1"
  },
  "Results": [
    {
      "IdentificationId": "IDR-0001",
      "SubjectType": "Sequence",
      "SubjectId": "SEQ-0001",
      "DossierId": "DOS-0001",
      "Dimension": "TECHNICAL_STANDARD",
      "EvaluationStatus": "Conflict",
      "Value": null,
      "ValueSet": null,
      "Confidence": "UNKNOWN",
      "ReviewRequired": true,
      "ValueSource": null,
      "Candidates": [
        {
          "Value": "ICH_ECTD_3_2_2",
          "BestSupportStrength": "STRONG",
          "BestContradictionStrength": "STRONG",
          "SupportingRuleIds": [
            "ID-TS-ROOT1"
          ],
          "ContradictingRuleIds": [
            "ID-TS-NS-CONTRA"
          ],
          "SupportingEvidence": [
            {
              "EvidenceId": "EVD-0003",
              "RawStrength": "Strong",
              "NormalizedStrength": "STRONG",
              "SourceTier": "StructuredXml"
            }
          ],
          "ContradictingEvidence": [
            {
              "EvidenceId": "EVD-0004",
              "RawStrength": "Strong",
              "NormalizedStrength": "STRONG",
              "SourceTier": "StructuredXml"
            }
          ]
        }
      ],
      "SupportingEvidenceIds": [
        "EVD-0003"
      ],
      "ContradictingEvidenceIds": [
        "EVD-0004"
      ],
      "UnavailableEvidence": [],
      "FiredRuleIds": [
        "ID-TS-NS-CONTRA",
        "ID-TS-ROOT1"
      ],
      "ScoreSummary": {
        "ScoreModel": "ORDINAL_TIER/1",
        "BestStrength": "STRONG",
        "TierRank": 1,
        "CountByStrength": {
          "STRONG": 1,
          "MEDIUM": 0,
          "WEAK": 0
        },
        "IndependentSourceClassCount": null
      },
      "LimitingFactors": [
        "SupportContradictedAtBestStrength"
      ]
    }
  ]
}
