{
  "ContractId": "eMAS.MS04.PreSales.Identification/1.0",
  "Execution": {
    "Capability": "IdentificationInterpretation",
    "ExecutionId": "EXE-ORACLE-IDO-05",
    "EngineVersion": null,
    "StartedAtUtc": null,
    "CompletedAtUtc": null,
    "CompletionStatus": "Completed"
  },
  "EvidenceSource": {
    "ContractId": "eMAS.MS04.PreSales.ScannerObservations/1.0",
    "ExecutionId": "EXE-ORACLE-IDO-05",
    "DocumentSha256": "a41806efc5af66e313ddaa248e489889bbd4f05695bc9b3bb0a2c2f4ad104c5f"
  },
  "RuntimeConfig": {
    "ConfigurationId": "ORACLE_IDO_05",
    "SchemaVersion": "1.1.0",
    "MappingVersion": "1.0.0",
    "ExportType": "DEV",
    "Sha256": "1edb34b92b76d3dbd434a46b2fffe76c7d677c90555cb1772836af7ffa12c42f"
  },
  "Normalization": {
    "PolicyId": "EVIDENCE-STRENGTH-NORMALIZATION",
    "Version": "1",
    "Mapping": {
      "Strong": "STRONG",
      "Supporting": "MEDIUM",
      "Weak": "WEAK"
    }
  },
  "FieldProjection": {
    "PolicyId": "CEC-FIELD-PROJECTION",
    "Version": "1"
  },
  "Results": [
    {
      "IdentificationId": "IDR-0001",
      "SubjectType": "Sequence",
      "SubjectId": "SEQ-0001",
      "DossierId": "DOS-0001",
      "Dimension": "TECHNICAL_STANDARD",
      "EvaluationStatus": "Evaluated",
      "Value": "ICH_ECTD_3_2_2",
      "ValueSet": null,
      "Confidence": "LOW",
      "ReviewRequired": true,
      "ValueSource": "Derived",
      "Candidates": [
        {
          "Value": "ICH_ECTD_3_2_2",
          "BestSupportStrength": "MEDIUM",
          "BestContradictionStrength": null,
          "SupportingRuleIds": [
            "ID-TS-PRES"
          ],
          "ContradictingRuleIds": [],
          "SupportingEvidence": [
            {
              "EvidenceId": "EVD-0002",
              "RawStrength": "Supporting",
              "NormalizedStrength": "MEDIUM",
              "SourceTier": "OfficialPhysicalPath"
            }
          ],
          "ContradictingEvidence": []
        },
        {
          "Value": "OTHER",
          "BestSupportStrength": "WEAK",
          "BestContradictionStrength": null,
          "SupportingRuleIds": [
            "ID-TS-PATH-OTHER"
          ],
          "ContradictingRuleIds": [],
          "SupportingEvidence": [
            {
              "EvidenceId": "EVD-0001",
              "RawStrength": "Weak",
              "NormalizedStrength": "WEAK",
              "SourceTier": "FolderNameHeuristic"
            }
          ],
          "ContradictingEvidence": []
        }
      ],
      "SupportingEvidenceIds": [
        "EVD-0001",
        "EVD-0002"
      ],
      "ContradictingEvidenceIds": [],
      "UnavailableEvidence": [],
      "FiredRuleIds": [
        "ID-TS-PATH-OTHER",
        "ID-TS-PRES"
      ],
      "ScoreSummary": {
        "ScoreModel": "ORDINAL_TIER/1",
        "BestStrength": "MEDIUM",
        "TierRank": 2,
        "CountByStrength": {
          "STRONG": 0,
          "MEDIUM": 1,
          "WEAK": 1
        },
        "IndependentSourceClassCount": 1
      },
      "LimitingFactors": []
    }
  ]
}
